[INFO] Scanning for projects...
[WARNING] 
[WARNING] Some problems were encountered while building the effective model for com.projeto:insuranceclaim-backend:jar:0.0.1-SNAPSHOT
[WARNING] 'dependencies.dependency.(groupId:artifactId:type:classifier)' must be unique: software.amazon.awssdk:s3:jar -> duplicate declaration of version (?) @ line 88, column 15
[WARNING] 
[WARNING] It is highly recommended to fix these problems because they threaten the stability of your build.
[WARNING] 
[WARNING] For this reason, future Maven versions might no longer support building such malformed projects.
[WARNING] 
[INFO] 
[INFO] -----------------< com.projeto:insuranceclaim-backend >-----------------
[INFO] Building insuranceclaim-backend 0.0.1-SNAPSHOT
[INFO]   from pom.xml
[INFO] --------------------------------[ jar ]---------------------------------
[INFO] 
[INFO] --- clean:3.4.0:clean (default-clean) @ insuranceclaim-backend ---
[INFO] Deleting F:\Projetos\insurance-backup-project\backend\target
[INFO] 
[INFO] --- resources:3.3.1:resources (default-resources) @ insuranceclaim-backend ---
[INFO] Copying 1 resource from src\main\resources to target\classes
[INFO] Copying 1 resource from src\main\resources to target\classes
[INFO] 
[INFO] --- compiler:3.13.0:compile (default-compile) @ insuranceclaim-backend ---
[INFO] Recompiling the module because of changed source code.
[INFO] Compiling 10 source files with javac [debug parameters release 21] to target\classes
[INFO] 
[INFO] --- resources:3.3.1:testResources (default-testResources) @ insuranceclaim-backend ---
[INFO] Copying 1 resource from src\test\resources to target\test-classes
[INFO] 
[INFO] --- compiler:3.13.0:testCompile (default-testCompile) @ insuranceclaim-backend ---
[INFO] Recompiling the module because of changed dependency.
[INFO] Compiling 1 source file with javac [debug parameters release 21] to target\test-classes
[INFO] 
[INFO] --- surefire:3.5.2:test (default-test) @ insuranceclaim-backend ---
[INFO] Using auto detected provider org.apache.maven.surefire.junitplatform.JUnitPlatformProvider
[INFO] 
[INFO] -------------------------------------------------------
[INFO]  T E S T S
[INFO] -------------------------------------------------------
[INFO] Running com.example.insuranceclaim_backend.InsuranceclaimBackendApplicationTests
Standard Commons Logging discovery in action with spring-jcl: please remove commons-logging.jar from classpath in order to avoid potential conflicts
12:42:37.761 [main] INFO org.springframework.test.context.support.AnnotationConfigContextLoaderUtils -- Could not detect default configuration classes for test class [com.example.insuranceclaim_backend.InsuranceclaimBackendApplicationTests]: InsuranceclaimBackendApplicationTests does not declare any static, non-private, non-final, nested classes annotated with @Configuration.
12:42:37.844 [main] INFO org.springframework.boot.test.context.SpringBootTestContextBootstrapper -- Found @SpringBootConfiguration com.example.insuranceclaim_backend.InsuranceclaimBackendApplication for test class com.example.insuranceclaim_backend.InsuranceclaimBackendApplicationTests

  .   ____          _            __ _ _
 /\\ / ___'_ __ _ _(_)_ __  __ _ \ \ \ \
( ( )\___ | '_ | '_| | '_ \/ _` | \ \ \ \
 \\/  ___)| |_)| | | | | || (_| |  ) ) ) )
  '  |____| .__|_| |_|_| |_\__, | / / / /
 =========|_|==============|___/=/_/_/_/

 :: Spring Boot ::                (v3.4.2)

2025-01-29T12:42:38.194-03:00  INFO 50932 --- [insuranceclaim-backend] [           main] .i.InsuranceclaimBackendApplicationTests : Starting InsuranceclaimBackendApplicationTests using Java 21.0.6 with PID 50932 (started by rafao in F:\Projetos\insurance-backup-project\backend)
2025-01-29T12:42:38.195-03:00  INFO 50932 --- [insuranceclaim-backend] [           main] .i.InsuranceclaimBackendApplicationTests : The following 1 profile is active: "test"
2025-01-29T12:42:39.896-03:00  WARN 50932 --- [insuranceclaim-backend] [           main] o.s.w.c.s.GenericWebApplicationContext   : Exception encountered during context initialization - cancelling refresh attempt: org.springframework.beans.factory.BeanCreationException: Error creating bean with name 's3StorageService' defined in file [F:\Projetos\insurance-backup-project\backend\target\classes\com\example\insuranceclaim_backend\service\S3StorageService.class]: Failed to instantiate [com.example.insuranceclaim_backend.service.S3StorageService]: Constructor threw exception
2025-01-29T12:42:39.919-03:00  INFO 50932 --- [insuranceclaim-backend] [           main] .s.b.a.l.ConditionEvaluationReportLogger : 

Error starting ApplicationContext. To display the condition evaluation report re-run your application with 'debug' enabled.
2025-01-29T12:42:39.934-03:00 ERROR 50932 --- [insuranceclaim-backend] [           main] o.s.boot.SpringApplication               : Application run failed

org.springframework.beans.factory.BeanCreationException: Error creating bean with name 's3StorageService' defined in file [F:\Projetos\insurance-backup-project\backend\target\classes\com\example\insuranceclaim_backend\service\S3StorageService.class]: Failed to instantiate [com.example.insuranceclaim_backend.service.S3StorageService]: Constructor threw exception
	at org.springframework.beans.factory.support.ConstructorResolver.instantiate(ConstructorResolver.java:321) ~[spring-beans-6.2.2.jar:6.2.2]
	at org.springframework.beans.factory.support.ConstructorResolver.autowireConstructor(ConstructorResolver.java:309) ~[spring-beans-6.2.2.jar:6.2.2]
	at org.springframework.beans.factory.support.AbstractAutowireCapableBeanFactory.autowireConstructor(AbstractAutowireCapableBeanFactory.java:1381) ~[spring-beans-6.2.2.jar:6.2.2]
	at org.springframework.beans.factory.support.AbstractAutowireCapableBeanFactory.createBeanInstance(AbstractAutowireCapableBeanFactory.java:1218) ~[spring-beans-6.2.2.jar:6.2.2]
	at org.springframework.beans.factory.support.AbstractAutowireCapableBeanFactory.doCreateBean(AbstractAutowireCapableBeanFactory.java:563) ~[spring-beans-6.2.2.jar:6.2.2]
	at org.springframework.beans.factory.support.AbstractAutowireCapableBeanFactory.createBean(AbstractAutowireCapableBeanFactory.java:523) ~[spring-beans-6.2.2.jar:6.2.2]
	at org.springframework.beans.factory.support.AbstractBeanFactory.lambda$doGetBean$0(AbstractBeanFactory.java:336) ~[spring-beans-6.2.2.jar:6.2.2]
	at org.springframework.beans.factory.support.DefaultSingletonBeanRegistry.getSingleton(DefaultSingletonBeanRegistry.java:307) ~[spring-beans-6.2.2.jar:6.2.2]
	at org.springframework.beans.factory.support.AbstractBeanFactory.doGetBean(AbstractBeanFactory.java:334) ~[spring-beans-6.2.2.jar:6.2.2]
	at org.springframework.beans.factory.support.AbstractBeanFactory.getBean(AbstractBeanFactory.java:199) ~[spring-beans-6.2.2.jar:6.2.2]
	at org.springframework.beans.factory.support.DefaultListableBeanFactory.instantiateSingleton(DefaultListableBeanFactory.java:1122) ~[spring-beans-6.2.2.jar:6.2.2]
	at org.springframework.beans.factory.support.DefaultListableBeanFactory.preInstantiateSingleton(DefaultListableBeanFactory.java:1093) ~[spring-beans-6.2.2.jar:6.2.2]
	at org.springframework.beans.factory.support.DefaultListableBeanFactory.preInstantiateSingletons(DefaultListableBeanFactory.java:1030) ~[spring-beans-6.2.2.jar:6.2.2]
	at org.springframework.context.support.AbstractApplicationContext.finishBeanFactoryInitialization(AbstractApplicationContext.java:987) ~[spring-context-6.2.2.jar:6.2.2]
	at org.springframework.context.support.AbstractApplicationContext.refresh(AbstractApplicationContext.java:627) ~[spring-context-6.2.2.jar:6.2.2]
	at org.springframework.boot.SpringApplication.refresh(SpringApplication.java:752) ~[spring-boot-3.4.2.jar:3.4.2]
	at org.springframework.boot.SpringApplication.refreshContext(SpringApplication.java:439) ~[spring-boot-3.4.2.jar:3.4.2]
	at org.springframework.boot.SpringApplication.run(SpringApplication.java:318) ~[spring-boot-3.4.2.jar:3.4.2]
	at org.springframework.boot.test.context.SpringBootContextLoader.lambda$loadContext$3(SpringBootContextLoader.java:137) ~[spring-boot-test-3.4.2.jar:3.4.2]
	at org.springframework.util.function.ThrowingSupplier.get(ThrowingSupplier.java:58) ~[spring-core-6.2.2.jar:6.2.2]
	at org.springframework.util.function.ThrowingSupplier.get(ThrowingSupplier.java:46) ~[spring-core-6.2.2.jar:6.2.2]
	at org.springframework.boot.SpringApplication.withHook(SpringApplication.java:1461) ~[spring-boot-3.4.2.jar:3.4.2]
	at org.springframework.boot.test.context.SpringBootContextLoader$ContextLoaderHook.run(SpringBootContextLoader.java:553) ~[spring-boot-test-3.4.2.jar:3.4.2]
	at org.springframework.boot.test.context.SpringBootContextLoader.loadContext(SpringBootContextLoader.java:137) ~[spring-boot-test-3.4.2.jar:3.4.2]
	at org.springframework.boot.test.context.SpringBootContextLoader.loadContext(SpringBootContextLoader.java:108) ~[spring-boot-test-3.4.2.jar:3.4.2]
	at org.springframework.test.context.cache.DefaultCacheAwareContextLoaderDelegate.loadContextInternal(DefaultCacheAwareContextLoaderDelegate.java:225) ~[spring-test-6.2.2.jar:6.2.2]
	at org.springframework.test.context.cache.DefaultCacheAwareContextLoaderDelegate.loadContext(DefaultCacheAwareContextLoaderDelegate.java:152) ~[spring-test-6.2.2.jar:6.2.2]
	at org.springframework.test.context.support.DefaultTestContext.getApplicationContext(DefaultTestContext.java:130) ~[spring-test-6.2.2.jar:6.2.2]
	at org.springframework.test.context.web.ServletTestExecutionListener.setUpRequestContextIfNecessary(ServletTestExecutionListener.java:191) ~[spring-test-6.2.2.jar:6.2.2]
	at org.springframework.test.context.web.ServletTestExecutionListener.prepareTestInstance(ServletTestExecutionListener.java:130) ~[spring-test-6.2.2.jar:6.2.2]
	at org.springframework.test.context.TestContextManager.prepareTestInstance(TestContextManager.java:260) ~[spring-test-6.2.2.jar:6.2.2]
	at org.springframework.test.context.junit.jupiter.SpringExtension.postProcessTestInstance(SpringExtension.java:160) ~[spring-test-6.2.2.jar:6.2.2]
	at org.junit.jupiter.engine.descriptor.ClassBasedTestDescriptor.lambda$invokeTestInstancePostProcessors$11(ClassBasedTestDescriptor.java:378) ~[junit-jupiter-engine-5.11.4.jar:5.11.4]
	at org.junit.jupiter.engine.descriptor.ClassBasedTestDescriptor.executeAndMaskThrowable(ClassBasedTestDescriptor.java:383) ~[junit-jupiter-engine-5.11.4.jar:5.11.4]
	at org.junit.jupiter.engine.descriptor.ClassBasedTestDescriptor.lambda$invokeTestInstancePostProcessors$12(ClassBasedTestDescriptor.java:378) ~[junit-jupiter-engine-5.11.4.jar:5.11.4]
	at java.base/java.util.stream.ForEachOps$ForEachOp$OfRef.accept(ForEachOps.java:184) ~[na:na]
	at java.base/java.util.stream.ReferencePipeline$3$1.accept(ReferencePipeline.java:197) ~[na:na]
	at java.base/java.util.stream.ReferencePipeline$2$1.accept(ReferencePipeline.java:179) ~[na:na]
	at java.base/java.util.stream.ReferencePipeline$3$1.accept(ReferencePipeline.java:197) ~[na:na]
	at java.base/java.util.ArrayList$ArrayListSpliterator.forEachRemaining(ArrayList.java:1708) ~[na:na]
	at java.base/java.util.stream.AbstractPipeline.copyInto(AbstractPipeline.java:509) ~[na:na]
	at java.base/java.util.stream.AbstractPipeline.wrapAndCopyInto(AbstractPipeline.java:499) ~[na:na]
	at java.base/java.util.stream.ForEachOps$ForEachOp.evaluateSequential(ForEachOps.java:151) ~[na:na]
	at java.base/java.util.stream.ForEachOps$ForEachOp$OfRef.evaluateSequential(ForEachOps.java:174) ~[na:na]
	at java.base/java.util.stream.AbstractPipeline.evaluate(AbstractPipeline.java:234) ~[na:na]
	at java.base/java.util.stream.ReferencePipeline.forEach(ReferencePipeline.java:596) ~[na:na]
	at org.junit.jupiter.engine.descriptor.ClassBasedTestDescriptor.invokeTestInstancePostProcessors(ClassBasedTestDescriptor.java:377) ~[junit-jupiter-engine-5.11.4.jar:5.11.4]
	at org.junit.jupiter.engine.descriptor.ClassBasedTestDescriptor.lambda$instantiateAndPostProcessTestInstance$7(ClassBasedTestDescriptor.java:290) ~[junit-jupiter-engine-5.11.4.jar:5.11.4]
	at org.junit.platform.engine.support.hierarchical.ThrowableCollector.execute(ThrowableCollector.java:73) ~[junit-platform-engine-1.11.4.jar:1.11.4]
	at org.junit.jupiter.engine.descriptor.ClassBasedTestDescriptor.instantiateAndPostProcessTestInstance(ClassBasedTestDescriptor.java:289) ~[junit-jupiter-engine-5.11.4.jar:5.11.4]
	at org.junit.jupiter.engine.descriptor.ClassBasedTestDescriptor.lambda$testInstancesProvider$5(ClassBasedTestDescriptor.java:279) ~[junit-jupiter-engine-5.11.4.jar:5.11.4]
	at java.base/java.util.Optional.orElseGet(Optional.java:364) ~[na:na]
	at org.junit.jupiter.engine.descriptor.ClassBasedTestDescriptor.lambda$testInstancesProvider$6(ClassBasedTestDescriptor.java:278) ~[junit-jupiter-engine-5.11.4.jar:5.11.4]
	at org.junit.jupiter.engine.execution.TestInstancesProvider.getTestInstances(TestInstancesProvider.java:31) ~[junit-jupiter-engine-5.11.4.jar:5.11.4]
	at org.junit.jupiter.engine.descriptor.TestMethodTestDescriptor.lambda$prepare$1(TestMethodTestDescriptor.java:105) ~[junit-jupiter-engine-5.11.4.jar:5.11.4]
	at org.junit.platform.engine.support.hierarchical.ThrowableCollector.execute(ThrowableCollector.java:73) ~[junit-platform-engine-1.11.4.jar:1.11.4]
	at org.junit.jupiter.engine.descriptor.TestMethodTestDescriptor.prepare(TestMethodTestDescriptor.java:104) ~[junit-jupiter-engine-5.11.4.jar:5.11.4]
	at org.junit.jupiter.engine.descriptor.TestMethodTestDescriptor.prepare(TestMethodTestDescriptor.java:68) ~[junit-jupiter-engine-5.11.4.jar:5.11.4]
	at org.junit.platform.engine.support.hierarchical.NodeTestTask.lambda$prepare$2(NodeTestTask.java:128) ~[junit-platform-engine-1.11.4.jar:1.11.4]
	at org.junit.platform.engine.support.hierarchical.ThrowableCollector.execute(ThrowableCollector.java:73) ~[junit-platform-engine-1.11.4.jar:1.11.4]
	at org.junit.platform.engine.support.hierarchical.NodeTestTask.prepare(NodeTestTask.java:128) ~[junit-platform-engine-1.11.4.jar:1.11.4]
	at org.junit.platform.engine.support.hierarchical.NodeTestTask.execute(NodeTestTask.java:95) ~[junit-platform-engine-1.11.4.jar:1.11.4]
	at java.base/java.util.ArrayList.forEach(ArrayList.java:1596) ~[na:na]
	at org.junit.platform.engine.support.hierarchical.SameThreadHierarchicalTestExecutorService.invokeAll(SameThreadHierarchicalTestExecutorService.java:41) ~[junit-platform-engine-1.11.4.jar:1.11.4]
	at org.junit.platform.engine.support.hierarchical.NodeTestTask.lambda$executeRecursively$6(NodeTestTask.java:160) ~[junit-platform-engine-1.11.4.jar:1.11.4]
	at org.junit.platform.engine.support.hierarchical.ThrowableCollector.execute(ThrowableCollector.java:73) ~[junit-platform-engine-1.11.4.jar:1.11.4]
	at org.junit.platform.engine.support.hierarchical.NodeTestTask.lambda$executeRecursively$8(NodeTestTask.java:146) ~[junit-platform-engine-1.11.4.jar:1.11.4]
	at org.junit.platform.engine.support.hierarchical.Node.around(Node.java:137) ~[junit-platform-engine-1.11.4.jar:1.11.4]
	at org.junit.platform.engine.support.hierarchical.NodeTestTask.lambda$executeRecursively$9(NodeTestTask.java:144) ~[junit-platform-engine-1.11.4.jar:1.11.4]
	at org.junit.platform.engine.support.hierarchical.ThrowableCollector.execute(ThrowableCollector.java:73) ~[junit-platform-engine-1.11.4.jar:1.11.4]
	at org.junit.platform.engine.support.hierarchical.NodeTestTask.executeRecursively(NodeTestTask.java:143) ~[junit-platform-engine-1.11.4.jar:1.11.4]
	at org.junit.platform.engine.support.hierarchical.NodeTestTask.execute(NodeTestTask.java:100) ~[junit-platform-engine-1.11.4.jar:1.11.4]
	at java.base/java.util.ArrayList.forEach(ArrayList.java:1596) ~[na:na]
	at org.junit.platform.engine.support.hierarchical.SameThreadHierarchicalTestExecutorService.invokeAll(SameThreadHierarchicalTestExecutorService.java:41) ~[junit-platform-engine-1.11.4.jar:1.11.4]
	at org.junit.platform.engine.support.hierarchical.NodeTestTask.lambda$executeRecursively$6(NodeTestTask.java:160) ~[junit-platform-engine-1.11.4.jar:1.11.4]
	at org.junit.platform.engine.support.hierarchical.ThrowableCollector.execute(ThrowableCollector.java:73) ~[junit-platform-engine-1.11.4.jar:1.11.4]
	at org.junit.platform.engine.support.hierarchical.NodeTestTask.lambda$executeRecursively$8(NodeTestTask.java:146) ~[junit-platform-engine-1.11.4.jar:1.11.4]
	at org.junit.platform.engine.support.hierarchical.Node.around(Node.java:137) ~[junit-platform-engine-1.11.4.jar:1.11.4]
	at org.junit.platform.engine.support.hierarchical.NodeTestTask.lambda$executeRecursively$9(NodeTestTask.java:144) ~[junit-platform-engine-1.11.4.jar:1.11.4]
	at org.junit.platform.engine.support.hierarchical.ThrowableCollector.execute(ThrowableCollector.java:73) ~[junit-platform-engine-1.11.4.jar:1.11.4]
	at org.junit.platform.engine.support.hierarchical.NodeTestTask.executeRecursively(NodeTestTask.java:143) ~[junit-platform-engine-1.11.4.jar:1.11.4]
	at org.junit.platform.engine.support.hierarchical.NodeTestTask.execute(NodeTestTask.java:100) ~[junit-platform-engine-1.11.4.jar:1.11.4]
	at org.junit.platform.engine.support.hierarchical.SameThreadHierarchicalTestExecutorService.submit(SameThreadHierarchicalTestExecutorService.java:35) ~[junit-platform-engine-1.11.4.jar:1.11.4]
	at org.junit.platform.engine.support.hierarchical.HierarchicalTestExecutor.execute(HierarchicalTestExecutor.java:57) ~[junit-platform-engine-1.11.4.jar:1.11.4]
	at org.junit.platform.engine.support.hierarchical.HierarchicalTestEngine.execute(HierarchicalTestEngine.java:54) ~[junit-platform-engine-1.11.4.jar:1.11.4]
	at org.junit.platform.launcher.core.EngineExecutionOrchestrator.execute(EngineExecutionOrchestrator.java:198) ~[junit-platform-launcher-1.11.4.jar:1.11.4]
	at org.junit.platform.launcher.core.EngineExecutionOrchestrator.execute(EngineExecutionOrchestrator.java:169) ~[junit-platform-launcher-1.11.4.jar:1.11.4]
	at org.junit.platform.launcher.core.EngineExecutionOrchestrator.execute(EngineExecutionOrchestrator.java:93) ~[junit-platform-launcher-1.11.4.jar:1.11.4]
	at org.junit.platform.launcher.core.EngineExecutionOrchestrator.lambda$execute$0(EngineExecutionOrchestrator.java:58) ~[junit-platform-launcher-1.11.4.jar:1.11.4]
	at org.junit.platform.launcher.core.EngineExecutionOrchestrator.withInterceptedStreams(EngineExecutionOrchestrator.java:141) ~[junit-platform-launcher-1.11.4.jar:1.11.4]
	at org.junit.platform.launcher.core.EngineExecutionOrchestrator.execute(EngineExecutionOrchestrator.java:57) ~[junit-platform-launcher-1.11.4.jar:1.11.4]
	at org.junit.platform.launcher.core.DefaultLauncher.execute(DefaultLauncher.java:103) ~[junit-platform-launcher-1.11.4.jar:1.11.4]
	at org.junit.platform.launcher.core.DefaultLauncher.execute(DefaultLauncher.java:85) ~[junit-platform-launcher-1.11.4.jar:1.11.4]
	at org.junit.platform.launcher.core.DelegatingLauncher.execute(DelegatingLauncher.java:47) ~[junit-platform-launcher-1.11.4.jar:1.11.4]
	at org.apache.maven.surefire.junitplatform.LazyLauncher.execute(LazyLauncher.java:56) ~[surefire-junit-platform-3.5.2.jar:3.5.2]
	at org.apache.maven.surefire.junitplatform.JUnitPlatformProvider.execute(JUnitPlatformProvider.java:184) ~[surefire-junit-platform-3.5.2.jar:3.5.2]
	at org.apache.maven.surefire.junitplatform.JUnitPlatformProvider.invokeAllTests(JUnitPlatformProvider.java:148) ~[surefire-junit-platform-3.5.2.jar:3.5.2]
	at org.apache.maven.surefire.junitplatform.JUnitPlatformProvider.invoke(JUnitPlatformProvider.java:122) ~[surefire-junit-platform-3.5.2.jar:3.5.2]
	at org.apache.maven.surefire.booter.ForkedBooter.runSuitesInProcess(ForkedBooter.java:385) ~[surefire-booter-3.5.2.jar:3.5.2]
	at org.apache.maven.surefire.booter.ForkedBooter.execute(ForkedBooter.java:162) ~[surefire-booter-3.5.2.jar:3.5.2]
	at org.apache.maven.surefire.booter.ForkedBooter.run(ForkedBooter.java:507) ~[surefire-booter-3.5.2.jar:3.5.2]
	at org.apache.maven.surefire.booter.ForkedBooter.main(ForkedBooter.java:495) ~[surefire-booter-3.5.2.jar:3.5.2]
Caused by: org.springframework.beans.BeanInstantiationException: Failed to instantiate [com.example.insuranceclaim_backend.service.S3StorageService]: Constructor threw exception
	at org.springframework.beans.BeanUtils.instantiateClass(BeanUtils.java:222) ~[spring-beans-6.2.2.jar:6.2.2]
	at org.springframework.beans.factory.support.SimpleInstantiationStrategy.instantiate(SimpleInstantiationStrategy.java:145) ~[spring-beans-6.2.2.jar:6.2.2]
	at org.springframework.beans.factory.support.ConstructorResolver.instantiate(ConstructorResolver.java:318) ~[spring-beans-6.2.2.jar:6.2.2]
	... 101 common frames omitted
Caused by: software.amazon.awssdk.core.exception.SdkClientException: Unable to marshall request to JSON: Parameter 'Bucket' must not be null
	at software.amazon.awssdk.core.exception.SdkClientException$BuilderImpl.build(SdkClientException.java:111) ~[sdk-core-2.20.28.jar:na]
	at software.amazon.awssdk.services.s3.transform.HeadBucketRequestMarshaller.marshall(HeadBucketRequestMarshaller.java:53) ~[s3-2.20.28.jar:na]
	at software.amazon.awssdk.services.s3.transform.HeadBucketRequestMarshaller.marshall(HeadBucketRequestMarshaller.java:31) ~[s3-2.20.28.jar:na]
	at software.amazon.awssdk.core.internal.handler.BaseClientHandler.lambda$finalizeSdkHttpFullRequest$0(BaseClientHandler.java:73) ~[sdk-core-2.20.28.jar:na]
	at software.amazon.awssdk.core.internal.util.MetricUtils.measureDuration(MetricUtils.java:50) ~[sdk-core-2.20.28.jar:na]
	at software.amazon.awssdk.core.internal.handler.BaseClientHandler.finalizeSdkHttpFullRequest(BaseClientHandler.java:72) ~[sdk-core-2.20.28.jar:na]
	at software.amazon.awssdk.core.internal.handler.BaseSyncClientHandler.doExecute(BaseSyncClientHandler.java:151) ~[sdk-core-2.20.28.jar:na]
	at software.amazon.awssdk.core.internal.handler.BaseSyncClientHandler.lambda$execute$1(BaseSyncClientHandler.java:82) ~[sdk-core-2.20.28.jar:na]
	at software.amazon.awssdk.core.internal.handler.BaseSyncClientHandler.measureApiCallSuccess(BaseSyncClientHandler.java:179) ~[sdk-core-2.20.28.jar:na]
	at software.amazon.awssdk.core.internal.handler.BaseSyncClientHandler.execute(BaseSyncClientHandler.java:76) ~[sdk-core-2.20.28.jar:na]
	at software.amazon.awssdk.core.client.handler.SdkSyncClientHandler.execute(SdkSyncClientHandler.java:45) ~[sdk-core-2.20.28.jar:na]
	at software.amazon.awssdk.awscore.client.handler.AwsSyncClientHandler.execute(AwsSyncClientHandler.java:56) ~[aws-core-2.20.28.jar:na]
	at software.amazon.awssdk.services.s3.DefaultS3Client.headBucket(DefaultS3Client.java:5249) ~[s3-2.20.28.jar:na]
	at com.example.insuranceclaim_backend.service.S3StorageService.ensureBucketExists(S3StorageService.java:27) ~[classes/:na]
	at com.example.insuranceclaim_backend.service.S3StorageService.<init>(S3StorageService.java:22) ~[classes/:na]
	at java.base/jdk.internal.reflect.DirectConstructorHandleAccessor.newInstance(DirectConstructorHandleAccessor.java:62) ~[na:na]
	at java.base/java.lang.reflect.Constructor.newInstanceWithCaller(Constructor.java:502) ~[na:na]
	at java.base/java.lang.reflect.Constructor.newInstance(Constructor.java:486) ~[na:na]
	at org.springframework.beans.BeanUtils.instantiateClass(BeanUtils.java:209) ~[spring-beans-6.2.2.jar:6.2.2]
	... 103 common frames omitted
Caused by: java.lang.IllegalArgumentException: Parameter 'Bucket' must not be null
	at software.amazon.awssdk.protocols.xml.internal.marshall.SimpleTypePathMarshaller.lambda$static$0(SimpleTypePathMarshaller.java:46) ~[aws-xml-protocol-2.20.28.jar:na]
	at software.amazon.awssdk.protocols.xml.internal.marshall.XmlProtocolMarshaller.doMarshall(XmlProtocolMarshaller.java:104) ~[aws-xml-protocol-2.20.28.jar:na]
	at software.amazon.awssdk.protocols.xml.internal.marshall.XmlProtocolMarshaller.marshall(XmlProtocolMarshaller.java:80) ~[aws-xml-protocol-2.20.28.jar:na]
	at software.amazon.awssdk.protocols.xml.internal.marshall.XmlProtocolMarshaller.marshall(XmlProtocolMarshaller.java:49) ~[aws-xml-protocol-2.20.28.jar:na]
	at software.amazon.awssdk.services.s3.transform.HeadBucketRequestMarshaller.marshall(HeadBucketRequestMarshaller.java:51) ~[s3-2.20.28.jar:na]
	... 120 common frames omitted

2025-01-29T12:42:39.941-03:00  WARN 50932 --- [insuranceclaim-backend] [           main] o.s.test.context.TestContextManager      : Caught exception while allowing TestExecutionListener [org.springframework.test.context.web.ServletTestExecutionListener] to prepare test instance [com.example.insuranceclaim_backend.InsuranceclaimBackendApplicationTests@72237be8]

java.lang.IllegalStateException: Failed to load ApplicationContext for [WebMergedContextConfiguration@7e76a66f testClass = com.example.insuranceclaim_backend.InsuranceclaimBackendApplicationTests, locations = [], classes = [com.example.insuranceclaim_backend.InsuranceclaimBackendApplication], contextInitializerClasses = [], activeProfiles = ["test"], propertySourceDescriptors = [], propertySourceProperties = ["org.springframework.boot.test.context.SpringBootTestContextBootstrapper=true"], contextCustomizers = [org.springframework.boot.test.context.filter.ExcludeFilterContextCustomizer@4808bc9b, org.springframework.boot.test.json.DuplicateJsonObjectContextCustomizerFactory$DuplicateJsonObjectContextCustomizer@72d6b3ba, org.springframework.boot.test.mock.mockito.MockitoContextCustomizer@0, org.springframework.boot.test.web.client.TestRestTemplateContextCustomizer@471a9022, org.springframework.boot.test.web.reactor.netty.DisableReactorResourceFactoryGlobalResourcesContextCustomizerFactory$DisableReactorResourceFactoryGlobalResourcesContextCustomizerCustomizer@791d1f8b, org.springframework.boot.test.autoconfigure.OnFailureConditionReportContextCustomizerFactory$OnFailureConditionReportContextCustomizer@13bc8645, org.springframework.boot.test.autoconfigure.actuate.observability.ObservabilityContextCustomizerFactory$DisableObservabilityContextCustomizer@1f, org.springframework.boot.test.autoconfigure.properties.PropertyMappingContextCustomizer@0, org.springframework.boot.test.autoconfigure.web.servlet.WebDriverContextCustomizer@4f4c4b1a, org.springframework.test.context.support.DynamicPropertiesContextCustomizer@0, org.springframework.boot.test.context.SpringBootTestAnnotation@bd271ef8], resourceBasePath = "src/main/webapp", contextLoader = org.springframework.boot.test.context.SpringBootContextLoader, parent = null]
	at org.springframework.test.context.cache.DefaultCacheAwareContextLoaderDelegate.loadContext(DefaultCacheAwareContextLoaderDelegate.java:180) ~[spring-test-6.2.2.jar:6.2.2]
	at org.springframework.test.context.support.DefaultTestContext.getApplicationContext(DefaultTestContext.java:130) ~[spring-test-6.2.2.jar:6.2.2]
	at org.springframework.test.context.web.ServletTestExecutionListener.setUpRequestContextIfNecessary(ServletTestExecutionListener.java:191) ~[spring-test-6.2.2.jar:6.2.2]
	at org.springframework.test.context.web.ServletTestExecutionListener.prepareTestInstance(ServletTestExecutionListener.java:130) ~[spring-test-6.2.2.jar:6.2.2]
	at org.springframework.test.context.TestContextManager.prepareTestInstance(TestContextManager.java:260) ~[spring-test-6.2.2.jar:6.2.2]
	at org.springframework.test.context.junit.jupiter.SpringExtension.postProcessTestInstance(SpringExtension.java:160) ~[spring-test-6.2.2.jar:6.2.2]
	at org.junit.jupiter.engine.descriptor.ClassBasedTestDescriptor.lambda$invokeTestInstancePostProcessors$11(ClassBasedTestDescriptor.java:378) ~[junit-jupiter-engine-5.11.4.jar:5.11.4]
	at org.junit.jupiter.engine.descriptor.ClassBasedTestDescriptor.executeAndMaskThrowable(ClassBasedTestDescriptor.java:383) ~[junit-jupiter-engine-5.11.4.jar:5.11.4]
	at org.junit.jupiter.engine.descriptor.ClassBasedTestDescriptor.lambda$invokeTestInstancePostProcessors$12(ClassBasedTestDescriptor.java:378) ~[junit-jupiter-engine-5.11.4.jar:5.11.4]
	at java.base/java.util.stream.ForEachOps$ForEachOp$OfRef.accept(ForEachOps.java:184) ~[na:na]
	at java.base/java.util.stream.ReferencePipeline$3$1.accept(ReferencePipeline.java:197) ~[na:na]
	at java.base/java.util.stream.ReferencePipeline$2$1.accept(ReferencePipeline.java:179) ~[na:na]
	at java.base/java.util.stream.ReferencePipeline$3$1.accept(ReferencePipeline.java:197) ~[na:na]
	at java.base/java.util.ArrayList$ArrayListSpliterator.forEachRemaining(ArrayList.java:1708) ~[na:na]
	at java.base/java.util.stream.AbstractPipeline.copyInto(AbstractPipeline.java:509) ~[na:na]
	at java.base/java.util.stream.AbstractPipeline.wrapAndCopyInto(AbstractPipeline.java:499) ~[na:na]
	at java.base/java.util.stream.ForEachOps$ForEachOp.evaluateSequential(ForEachOps.java:151) ~[na:na]
	at java.base/java.util.stream.ForEachOps$ForEachOp$OfRef.evaluateSequential(ForEachOps.java:174) ~[na:na]
	at java.base/java.util.stream.AbstractPipeline.evaluate(AbstractPipeline.java:234) ~[na:na]
	at java.base/java.util.stream.ReferencePipeline.forEach(ReferencePipeline.java:596) ~[na:na]
	at org.junit.jupiter.engine.descriptor.ClassBasedTestDescriptor.invokeTestInstancePostProcessors(ClassBasedTestDescriptor.java:377) ~[junit-jupiter-engine-5.11.4.jar:5.11.4]
	at org.junit.jupiter.engine.descriptor.ClassBasedTestDescriptor.lambda$instantiateAndPostProcessTestInstance$7(ClassBasedTestDescriptor.java:290) ~[junit-jupiter-engine-5.11.4.jar:5.11.4]
	at org.junit.platform.engine.support.hierarchical.ThrowableCollector.execute(ThrowableCollector.java:73) ~[junit-platform-engine-1.11.4.jar:1.11.4]
	at org.junit.jupiter.engine.descriptor.ClassBasedTestDescriptor.instantiateAndPostProcessTestInstance(ClassBasedTestDescriptor.java:289) ~[junit-jupiter-engine-5.11.4.jar:5.11.4]
	at org.junit.jupiter.engine.descriptor.ClassBasedTestDescriptor.lambda$testInstancesProvider$5(ClassBasedTestDescriptor.java:279) ~[junit-jupiter-engine-5.11.4.jar:5.11.4]
	at java.base/java.util.Optional.orElseGet(Optional.java:364) ~[na:na]
	at org.junit.jupiter.engine.descriptor.ClassBasedTestDescriptor.lambda$testInstancesProvider$6(ClassBasedTestDescriptor.java:278) ~[junit-jupiter-engine-5.11.4.jar:5.11.4]
	at org.junit.jupiter.engine.execution.TestInstancesProvider.getTestInstances(TestInstancesProvider.java:31) ~[junit-jupiter-engine-5.11.4.jar:5.11.4]
	at org.junit.jupiter.engine.descriptor.TestMethodTestDescriptor.lambda$prepare$1(TestMethodTestDescriptor.java:105) ~[junit-jupiter-engine-5.11.4.jar:5.11.4]
	at org.junit.platform.engine.support.hierarchical.ThrowableCollector.execute(ThrowableCollector.java:73) ~[junit-platform-engine-1.11.4.jar:1.11.4]
	at org.junit.jupiter.engine.descriptor.TestMethodTestDescriptor.prepare(TestMethodTestDescriptor.java:104) ~[junit-jupiter-engine-5.11.4.jar:5.11.4]
	at org.junit.jupiter.engine.descriptor.TestMethodTestDescriptor.prepare(TestMethodTestDescriptor.java:68) ~[junit-jupiter-engine-5.11.4.jar:5.11.4]
	at org.junit.platform.engine.support.hierarchical.NodeTestTask.lambda$prepare$2(NodeTestTask.java:128) ~[junit-platform-engine-1.11.4.jar:1.11.4]
	at org.junit.platform.engine.support.hierarchical.ThrowableCollector.execute(ThrowableCollector.java:73) ~[junit-platform-engine-1.11.4.jar:1.11.4]
	at org.junit.platform.engine.support.hierarchical.NodeTestTask.prepare(NodeTestTask.java:128) ~[junit-platform-engine-1.11.4.jar:1.11.4]
	at org.junit.platform.engine.support.hierarchical.NodeTestTask.execute(NodeTestTask.java:95) ~[junit-platform-engine-1.11.4.jar:1.11.4]
	at java.base/java.util.ArrayList.forEach(ArrayList.java:1596) ~[na:na]
	at org.junit.platform.engine.support.hierarchical.SameThreadHierarchicalTestExecutorService.invokeAll(SameThreadHierarchicalTestExecutorService.java:41) ~[junit-platform-engine-1.11.4.jar:1.11.4]
	at org.junit.platform.engine.support.hierarchical.NodeTestTask.lambda$executeRecursively$6(NodeTestTask.java:160) ~[junit-platform-engine-1.11.4.jar:1.11.4]
	at org.junit.platform.engine.support.hierarchical.ThrowableCollector.execute(ThrowableCollector.java:73) ~[junit-platform-engine-1.11.4.jar:1.11.4]
	at org.junit.platform.engine.support.hierarchical.NodeTestTask.lambda$executeRecursively$8(NodeTestTask.java:146) ~[junit-platform-engine-1.11.4.jar:1.11.4]
	at org.junit.platform.engine.support.hierarchical.Node.around(Node.java:137) ~[junit-platform-engine-1.11.4.jar:1.11.4]
	at org.junit.platform.engine.support.hierarchical.NodeTestTask.lambda$executeRecursively$9(NodeTestTask.java:144) ~[junit-platform-engine-1.11.4.jar:1.11.4]
	at org.junit.platform.engine.support.hierarchical.ThrowableCollector.execute(ThrowableCollector.java:73) ~[junit-platform-engine-1.11.4.jar:1.11.4]
	at org.junit.platform.engine.support.hierarchical.NodeTestTask.executeRecursively(NodeTestTask.java:143) ~[junit-platform-engine-1.11.4.jar:1.11.4]
	at org.junit.platform.engine.support.hierarchical.NodeTestTask.execute(NodeTestTask.java:100) ~[junit-platform-engine-1.11.4.jar:1.11.4]
	at java.base/java.util.ArrayList.forEach(ArrayList.java:1596) ~[na:na]
	at org.junit.platform.engine.support.hierarchical.SameThreadHierarchicalTestExecutorService.invokeAll(SameThreadHierarchicalTestExecutorService.java:41) ~[junit-platform-engine-1.11.4.jar:1.11.4]
	at org.junit.platform.engine.support.hierarchical.NodeTestTask.lambda$executeRecursively$6(NodeTestTask.java:160) ~[junit-platform-engine-1.11.4.jar:1.11.4]
	at org.junit.platform.engine.support.hierarchical.ThrowableCollector.execute(ThrowableCollector.java:73) ~[junit-platform-engine-1.11.4.jar:1.11.4]
	at org.junit.platform.engine.support.hierarchical.NodeTestTask.lambda$executeRecursively$8(NodeTestTask.java:146) ~[junit-platform-engine-1.11.4.jar:1.11.4]
	at org.junit.platform.engine.support.hierarchical.Node.around(Node.java:137) ~[junit-platform-engine-1.11.4.jar:1.11.4]
	at org.junit.platform.engine.support.hierarchical.NodeTestTask.lambda$executeRecursively$9(NodeTestTask.java:144) ~[junit-platform-engine-1.11.4.jar:1.11.4]
	at org.junit.platform.engine.support.hierarchical.ThrowableCollector.execute(ThrowableCollector.java:73) ~[junit-platform-engine-1.11.4.jar:1.11.4]
	at org.junit.platform.engine.support.hierarchical.NodeTestTask.executeRecursively(NodeTestTask.java:143) ~[junit-platform-engine-1.11.4.jar:1.11.4]
	at org.junit.platform.engine.support.hierarchical.NodeTestTask.execute(NodeTestTask.java:100) ~[junit-platform-engine-1.11.4.jar:1.11.4]
	at org.junit.platform.engine.support.hierarchical.SameThreadHierarchicalTestExecutorService.submit(SameThreadHierarchicalTestExecutorService.java:35) ~[junit-platform-engine-1.11.4.jar:1.11.4]
	at org.junit.platform.engine.support.hierarchical.HierarchicalTestExecutor.execute(HierarchicalTestExecutor.java:57) ~[junit-platform-engine-1.11.4.jar:1.11.4]
	at org.junit.platform.engine.support.hierarchical.HierarchicalTestEngine.execute(HierarchicalTestEngine.java:54) ~[junit-platform-engine-1.11.4.jar:1.11.4]
	at org.junit.platform.launcher.core.EngineExecutionOrchestrator.execute(EngineExecutionOrchestrator.java:198) ~[junit-platform-launcher-1.11.4.jar:1.11.4]
	at org.junit.platform.launcher.core.EngineExecutionOrchestrator.execute(EngineExecutionOrchestrator.java:169) ~[junit-platform-launcher-1.11.4.jar:1.11.4]
	at org.junit.platform.launcher.core.EngineExecutionOrchestrator.execute(EngineExecutionOrchestrator.java:93) ~[junit-platform-launcher-1.11.4.jar:1.11.4]
	at org.junit.platform.launcher.core.EngineExecutionOrchestrator.lambda$execute$0(EngineExecutionOrchestrator.java:58) ~[junit-platform-launcher-1.11.4.jar:1.11.4]
	at org.junit.platform.launcher.core.EngineExecutionOrchestrator.withInterceptedStreams(EngineExecutionOrchestrator.java:141) ~[junit-platform-launcher-1.11.4.jar:1.11.4]
	at org.junit.platform.launcher.core.EngineExecutionOrchestrator.execute(EngineExecutionOrchestrator.java:57) ~[junit-platform-launcher-1.11.4.jar:1.11.4]
	at org.junit.platform.launcher.core.DefaultLauncher.execute(DefaultLauncher.java:103) ~[junit-platform-launcher-1.11.4.jar:1.11.4]
	at org.junit.platform.launcher.core.DefaultLauncher.execute(DefaultLauncher.java:85) ~[junit-platform-launcher-1.11.4.jar:1.11.4]
	at org.junit.platform.launcher.core.DelegatingLauncher.execute(DelegatingLauncher.java:47) ~[junit-platform-launcher-1.11.4.jar:1.11.4]
	at org.apache.maven.surefire.junitplatform.LazyLauncher.execute(LazyLauncher.java:56) ~[surefire-junit-platform-3.5.2.jar:3.5.2]
	at org.apache.maven.surefire.junitplatform.JUnitPlatformProvider.execute(JUnitPlatformProvider.java:184) ~[surefire-junit-platform-3.5.2.jar:3.5.2]
	at org.apache.maven.surefire.junitplatform.JUnitPlatformProvider.invokeAllTests(JUnitPlatformProvider.java:148) ~[surefire-junit-platform-3.5.2.jar:3.5.2]
	at org.apache.maven.surefire.junitplatform.JUnitPlatformProvider.invoke(JUnitPlatformProvider.java:122) ~[surefire-junit-platform-3.5.2.jar:3.5.2]
	at org.apache.maven.surefire.booter.ForkedBooter.runSuitesInProcess(ForkedBooter.java:385) ~[surefire-booter-3.5.2.jar:3.5.2]
	at org.apache.maven.surefire.booter.ForkedBooter.execute(ForkedBooter.java:162) ~[surefire-booter-3.5.2.jar:3.5.2]
	at org.apache.maven.surefire.booter.ForkedBooter.run(ForkedBooter.java:507) ~[surefire-booter-3.5.2.jar:3.5.2]
	at org.apache.maven.surefire.booter.ForkedBooter.main(ForkedBooter.java:495) ~[surefire-booter-3.5.2.jar:3.5.2]
Caused by: org.springframework.beans.factory.BeanCreationException: Error creating bean with name 's3StorageService' defined in file [F:\Projetos\insurance-backup-project\backend\target\classes\com\example\insuranceclaim_backend\service\S3StorageService.class]: Failed to instantiate [com.example.insuranceclaim_backend.service.S3StorageService]: Constructor threw exception
	at org.springframework.beans.factory.support.ConstructorResolver.instantiate(ConstructorResolver.java:321) ~[spring-beans-6.2.2.jar:6.2.2]
	at org.springframework.beans.factory.support.ConstructorResolver.autowireConstructor(ConstructorResolver.java:309) ~[spring-beans-6.2.2.jar:6.2.2]
	at org.springframework.beans.factory.support.AbstractAutowireCapableBeanFactory.autowireConstructor(AbstractAutowireCapableBeanFactory.java:1381) ~[spring-beans-6.2.2.jar:6.2.2]
	at org.springframework.beans.factory.support.AbstractAutowireCapableBeanFactory.createBeanInstance(AbstractAutowireCapableBeanFactory.java:1218) ~[spring-beans-6.2.2.jar:6.2.2]
	at org.springframework.beans.factory.support.AbstractAutowireCapableBeanFactory.doCreateBean(AbstractAutowireCapableBeanFactory.java:563) ~[spring-beans-6.2.2.jar:6.2.2]
	at org.springframework.beans.factory.support.AbstractAutowireCapableBeanFactory.createBean(AbstractAutowireCapableBeanFactory.java:523) ~[spring-beans-6.2.2.jar:6.2.2]
	at org.springframework.beans.factory.support.AbstractBeanFactory.lambda$doGetBean$0(AbstractBeanFactory.java:336) ~[spring-beans-6.2.2.jar:6.2.2]
	at org.springframework.beans.factory.support.DefaultSingletonBeanRegistry.getSingleton(DefaultSingletonBeanRegistry.java:307) ~[spring-beans-6.2.2.jar:6.2.2]
	at org.springframework.beans.factory.support.AbstractBeanFactory.doGetBean(AbstractBeanFactory.java:334) ~[spring-beans-6.2.2.jar:6.2.2]
	at org.springframework.beans.factory.support.AbstractBeanFactory.getBean(AbstractBeanFactory.java:199) ~[spring-beans-6.2.2.jar:6.2.2]
	at org.springframework.beans.factory.support.DefaultListableBeanFactory.instantiateSingleton(DefaultListableBeanFactory.java:1122) ~[spring-beans-6.2.2.jar:6.2.2]
	at org.springframework.beans.factory.support.DefaultListableBeanFactory.preInstantiateSingleton(DefaultListableBeanFactory.java:1093) ~[spring-beans-6.2.2.jar:6.2.2]
	at org.springframework.beans.factory.support.DefaultListableBeanFactory.preInstantiateSingletons(DefaultListableBeanFactory.java:1030) ~[spring-beans-6.2.2.jar:6.2.2]
	at org.springframework.context.support.AbstractApplicationContext.finishBeanFactoryInitialization(AbstractApplicationContext.java:987) ~[spring-context-6.2.2.jar:6.2.2]
	at org.springframework.context.support.AbstractApplicationContext.refresh(AbstractApplicationContext.java:627) ~[spring-context-6.2.2.jar:6.2.2]
	at org.springframework.boot.SpringApplication.refresh(SpringApplication.java:752) ~[spring-boot-3.4.2.jar:3.4.2]
	at org.springframework.boot.SpringApplication.refreshContext(SpringApplication.java:439) ~[spring-boot-3.4.2.jar:3.4.2]
	at org.springframework.boot.SpringApplication.run(SpringApplication.java:318) ~[spring-boot-3.4.2.jar:3.4.2]
	at org.springframework.boot.test.context.SpringBootContextLoader.lambda$loadContext$3(SpringBootContextLoader.java:137) ~[spring-boot-test-3.4.2.jar:3.4.2]
	at org.springframework.util.function.ThrowingSupplier.get(ThrowingSupplier.java:58) ~[spring-core-6.2.2.jar:6.2.2]
	at org.springframework.util.function.ThrowingSupplier.get(ThrowingSupplier.java:46) ~[spring-core-6.2.2.jar:6.2.2]
	at org.springframework.boot.SpringApplication.withHook(SpringApplication.java:1461) ~[spring-boot-3.4.2.jar:3.4.2]
	at org.springframework.boot.test.context.SpringBootContextLoader$ContextLoaderHook.run(SpringBootContextLoader.java:553) ~[spring-boot-test-3.4.2.jar:3.4.2]
	at org.springframework.boot.test.context.SpringBootContextLoader.loadContext(SpringBootContextLoader.java:137) ~[spring-boot-test-3.4.2.jar:3.4.2]
	at org.springframework.boot.test.context.SpringBootContextLoader.loadContext(SpringBootContextLoader.java:108) ~[spring-boot-test-3.4.2.jar:3.4.2]
	at org.springframework.test.context.cache.DefaultCacheAwareContextLoaderDelegate.loadContextInternal(DefaultCacheAwareContextLoaderDelegate.java:225) ~[spring-test-6.2.2.jar:6.2.2]
	at org.springframework.test.context.cache.DefaultCacheAwareContextLoaderDelegate.loadContext(DefaultCacheAwareContextLoaderDelegate.java:152) ~[spring-test-6.2.2.jar:6.2.2]
	... 75 common frames omitted
Caused by: org.springframework.beans.BeanInstantiationException: Failed to instantiate [com.example.insuranceclaim_backend.service.S3StorageService]: Constructor threw exception
	at org.springframework.beans.BeanUtils.instantiateClass(BeanUtils.java:222) ~[spring-beans-6.2.2.jar:6.2.2]
	at org.springframework.beans.factory.support.SimpleInstantiationStrategy.instantiate(SimpleInstantiationStrategy.java:145) ~[spring-beans-6.2.2.jar:6.2.2]
	at org.springframework.beans.factory.support.ConstructorResolver.instantiate(ConstructorResolver.java:318) ~[spring-beans-6.2.2.jar:6.2.2]
	... 101 common frames omitted
Caused by: software.amazon.awssdk.core.exception.SdkClientException: Unable to marshall request to JSON: Parameter 'Bucket' must not be null
	at software.amazon.awssdk.core.exception.SdkClientException$BuilderImpl.build(SdkClientException.java:111) ~[sdk-core-2.20.28.jar:na]
	at software.amazon.awssdk.services.s3.transform.HeadBucketRequestMarshaller.marshall(HeadBucketRequestMarshaller.java:53) ~[s3-2.20.28.jar:na]
	at software.amazon.awssdk.services.s3.transform.HeadBucketRequestMarshaller.marshall(HeadBucketRequestMarshaller.java:31) ~[s3-2.20.28.jar:na]
	at software.amazon.awssdk.core.internal.handler.BaseClientHandler.lambda$finalizeSdkHttpFullRequest$0(BaseClientHandler.java:73) ~[sdk-core-2.20.28.jar:na]
	at software.amazon.awssdk.core.internal.util.MetricUtils.measureDuration(MetricUtils.java:50) ~[sdk-core-2.20.28.jar:na]
	at software.amazon.awssdk.core.internal.handler.BaseClientHandler.finalizeSdkHttpFullRequest(BaseClientHandler.java:72) ~[sdk-core-2.20.28.jar:na]
	at software.amazon.awssdk.core.internal.handler.BaseSyncClientHandler.doExecute(BaseSyncClientHandler.java:151) ~[sdk-core-2.20.28.jar:na]
	at software.amazon.awssdk.core.internal.handler.BaseSyncClientHandler.lambda$execute$1(BaseSyncClientHandler.java:82) ~[sdk-core-2.20.28.jar:na]
	at software.amazon.awssdk.core.internal.handler.BaseSyncClientHandler.measureApiCallSuccess(BaseSyncClientHandler.java:179) ~[sdk-core-2.20.28.jar:na]
	at software.amazon.awssdk.core.internal.handler.BaseSyncClientHandler.execute(BaseSyncClientHandler.java:76) ~[sdk-core-2.20.28.jar:na]
	at software.amazon.awssdk.core.client.handler.SdkSyncClientHandler.execute(SdkSyncClientHandler.java:45) ~[sdk-core-2.20.28.jar:na]
	at software.amazon.awssdk.awscore.client.handler.AwsSyncClientHandler.execute(AwsSyncClientHandler.java:56) ~[aws-core-2.20.28.jar:na]
	at software.amazon.awssdk.services.s3.DefaultS3Client.headBucket(DefaultS3Client.java:5249) ~[s3-2.20.28.jar:na]
	at com.example.insuranceclaim_backend.service.S3StorageService.ensureBucketExists(S3StorageService.java:27) ~[classes/:na]
	at com.example.insuranceclaim_backend.service.S3StorageService.<init>(S3StorageService.java:22) ~[classes/:na]
	at java.base/jdk.internal.reflect.DirectConstructorHandleAccessor.newInstance(DirectConstructorHandleAccessor.java:62) ~[na:na]
	at java.base/java.lang.reflect.Constructor.newInstanceWithCaller(Constructor.java:502) ~[na:na]
	at java.base/java.lang.reflect.Constructor.newInstance(Constructor.java:486) ~[na:na]
	at org.springframework.beans.BeanUtils.instantiateClass(BeanUtils.java:209) ~[spring-beans-6.2.2.jar:6.2.2]
	... 103 common frames omitted
Caused by: java.lang.IllegalArgumentException: Parameter 'Bucket' must not be null
	at software.amazon.awssdk.protocols.xml.internal.marshall.SimpleTypePathMarshaller.lambda$static$0(SimpleTypePathMarshaller.java:46) ~[aws-xml-protocol-2.20.28.jar:na]
	at software.amazon.awssdk.protocols.xml.internal.marshall.XmlProtocolMarshaller.doMarshall(XmlProtocolMarshaller.java:104) ~[aws-xml-protocol-2.20.28.jar:na]
	at software.amazon.awssdk.protocols.xml.internal.marshall.XmlProtocolMarshaller.marshall(XmlProtocolMarshaller.java:80) ~[aws-xml-protocol-2.20.28.jar:na]
	at software.amazon.awssdk.protocols.xml.internal.marshall.XmlProtocolMarshaller.marshall(XmlProtocolMarshaller.java:49) ~[aws-xml-protocol-2.20.28.jar:na]
	at software.amazon.awssdk.services.s3.transform.HeadBucketRequestMarshaller.marshall(HeadBucketRequestMarshaller.java:51) ~[s3-2.20.28.jar:na]
	... 120 common frames omitted

[ERROR] Tests run: 1, Failures: 0, Errors: 1, Skipped: 0, Time elapsed: 2.323 s <<< FAILURE! -- in com.example.insuranceclaim_backend.InsuranceclaimBackendApplicationTests
[ERROR] com.example.insuranceclaim_backend.InsuranceclaimBackendApplicationTests.contextLoads -- Time elapsed: 0.006 s <<< ERROR!
java.lang.IllegalStateException: Failed to load ApplicationContext for [WebMergedContextConfiguration@7e76a66f testClass = com.example.insuranceclaim_backend.InsuranceclaimBackendApplicationTests, locations = [], classes = [com.example.insuranceclaim_backend.InsuranceclaimBackendApplication], contextInitializerClasses = [], activeProfiles = ["test"], propertySourceDescriptors = [], propertySourceProperties = ["org.springframework.boot.test.context.SpringBootTestContextBootstrapper=true"], contextCustomizers = [org.springframework.boot.test.context.filter.ExcludeFilterContextCustomizer@4808bc9b, org.springframework.boot.test.json.DuplicateJsonObjectContextCustomizerFactory$DuplicateJsonObjectContextCustomizer@72d6b3ba, org.springframework.boot.test.mock.mockito.MockitoContextCustomizer@0, org.springframework.boot.test.web.client.TestRestTemplateContextCustomizer@471a9022, org.springframework.boot.test.web.reactor.netty.DisableReactorResourceFactoryGlobalResourcesContextCustomizerFactory$DisableReactorResourceFactoryGlobalResourcesContextCustomizerCustomizer@791d1f8b, org.springframework.boot.test.autoconfigure.OnFailureConditionReportContextCustomizerFactory$OnFailureConditionReportContextCustomizer@13bc8645, org.springframework.boot.test.autoconfigure.actuate.observability.ObservabilityContextCustomizerFactory$DisableObservabilityContextCustomizer@1f, org.springframework.boot.test.autoconfigure.properties.PropertyMappingContextCustomizer@0, org.springframework.boot.test.autoconfigure.web.servlet.WebDriverContextCustomizer@4f4c4b1a, org.springframework.test.context.support.DynamicPropertiesContextCustomizer@0, org.springframework.boot.test.context.SpringBootTestAnnotation@bd271ef8], resourceBasePath = "src/main/webapp", contextLoader = org.springframework.boot.test.context.SpringBootContextLoader, parent = null]
	at org.springframework.test.context.cache.DefaultCacheAwareContextLoaderDelegate.loadContext(DefaultCacheAwareContextLoaderDelegate.java:180)
	at org.springframework.test.context.support.DefaultTestContext.getApplicationContext(DefaultTestContext.java:130)
	at org.springframework.test.context.web.ServletTestExecutionListener.setUpRequestContextIfNecessary(ServletTestExecutionListener.java:191)
	at org.springframework.test.context.web.ServletTestExecutionListener.prepareTestInstance(ServletTestExecutionListener.java:130)
	at org.springframework.test.context.TestContextManager.prepareTestInstance(TestContextManager.java:260)
	at org.springframework.test.context.junit.jupiter.SpringExtension.postProcessTestInstance(SpringExtension.java:160)
	at java.base/java.util.stream.ForEachOps$ForEachOp$OfRef.accept(ForEachOps.java:184)
	at java.base/java.util.stream.ReferencePipeline$3$1.accept(ReferencePipeline.java:197)
	at java.base/java.util.stream.ReferencePipeline$2$1.accept(ReferencePipeline.java:179)
	at java.base/java.util.stream.ReferencePipeline$3$1.accept(ReferencePipeline.java:197)
	at java.base/java.util.ArrayList$ArrayListSpliterator.forEachRemaining(ArrayList.java:1708)
	at java.base/java.util.stream.AbstractPipeline.copyInto(AbstractPipeline.java:509)
	at java.base/java.util.stream.AbstractPipeline.wrapAndCopyInto(AbstractPipeline.java:499)
	at java.base/java.util.stream.ForEachOps$ForEachOp.evaluateSequential(ForEachOps.java:151)
	at java.base/java.util.stream.ForEachOps$ForEachOp$OfRef.evaluateSequential(ForEachOps.java:174)
	at java.base/java.util.stream.AbstractPipeline.evaluate(AbstractPipeline.java:234)
	at java.base/java.util.stream.ReferencePipeline.forEach(ReferencePipeline.java:596)
	at java.base/java.util.Optional.orElseGet(Optional.java:364)
	at java.base/java.util.ArrayList.forEach(ArrayList.java:1596)
	at java.base/java.util.ArrayList.forEach(ArrayList.java:1596)
Caused by: org.springframework.beans.factory.BeanCreationException: Error creating bean with name 's3StorageService' defined in file [F:\Projetos\insurance-backup-project\backend\target\classes\com\example\insuranceclaim_backend\service\S3StorageService.class]: Failed to instantiate [com.example.insuranceclaim_backend.service.S3StorageService]: Constructor threw exception
	at org.springframework.beans.factory.support.ConstructorResolver.instantiate(ConstructorResolver.java:321)
	at org.springframework.beans.factory.support.ConstructorResolver.autowireConstructor(ConstructorResolver.java:309)
	at org.springframework.beans.factory.support.AbstractAutowireCapableBeanFactory.autowireConstructor(AbstractAutowireCapableBeanFactory.java:1381)
	at org.springframework.beans.factory.support.AbstractAutowireCapableBeanFactory.createBeanInstance(AbstractAutowireCapableBeanFactory.java:1218)
	at org.springframework.beans.factory.support.AbstractAutowireCapableBeanFactory.doCreateBean(AbstractAutowireCapableBeanFactory.java:563)
	at org.springframework.beans.factory.support.AbstractAutowireCapableBeanFactory.createBean(AbstractAutowireCapableBeanFactory.java:523)
	at org.springframework.beans.factory.support.AbstractBeanFactory.lambda$doGetBean$0(AbstractBeanFactory.java:336)
	at org.springframework.beans.factory.support.DefaultSingletonBeanRegistry.getSingleton(DefaultSingletonBeanRegistry.java:307)
	at org.springframework.beans.factory.support.AbstractBeanFactory.doGetBean(AbstractBeanFactory.java:334)
	at org.springframework.beans.factory.support.AbstractBeanFactory.getBean(AbstractBeanFactory.java:199)
	at org.springframework.beans.factory.support.DefaultListableBeanFactory.instantiateSingleton(DefaultListableBeanFactory.java:1122)
	at org.springframework.beans.factory.support.DefaultListableBeanFactory.preInstantiateSingleton(DefaultListableBeanFactory.java:1093)
	at org.springframework.beans.factory.support.DefaultListableBeanFactory.preInstantiateSingletons(DefaultListableBeanFactory.java:1030)
	at org.springframework.context.support.AbstractApplicationContext.finishBeanFactoryInitialization(AbstractApplicationContext.java:987)
	at org.springframework.context.support.AbstractApplicationContext.refresh(AbstractApplicationContext.java:627)
	at org.springframework.boot.SpringApplication.refresh(SpringApplication.java:752)
	at org.springframework.boot.SpringApplication.refreshContext(SpringApplication.java:439)
	at org.springframework.boot.SpringApplication.run(SpringApplication.java:318)
	at org.springframework.boot.test.context.SpringBootContextLoader.lambda$loadContext$3(SpringBootContextLoader.java:137)
	at org.springframework.util.function.ThrowingSupplier.get(ThrowingSupplier.java:58)
	at org.springframework.util.function.ThrowingSupplier.get(ThrowingSupplier.java:46)
	at org.springframework.boot.SpringApplication.withHook(SpringApplication.java:1461)
	at org.springframework.boot.test.context.SpringBootContextLoader$ContextLoaderHook.run(SpringBootContextLoader.java:553)
	at org.springframework.boot.test.context.SpringBootContextLoader.loadContext(SpringBootContextLoader.java:137)
	at org.springframework.boot.test.context.SpringBootContextLoader.loadContext(SpringBootContextLoader.java:108)
	at org.springframework.test.context.cache.DefaultCacheAwareContextLoaderDelegate.loadContextInternal(DefaultCacheAwareContextLoaderDelegate.java:225)
	at org.springframework.test.context.cache.DefaultCacheAwareContextLoaderDelegate.loadContext(DefaultCacheAwareContextLoaderDelegate.java:152)
	... 19 more
Caused by: org.springframework.beans.BeanInstantiationException: Failed to instantiate [com.example.insuranceclaim_backend.service.S3StorageService]: Constructor threw exception
	at org.springframework.beans.BeanUtils.instantiateClass(BeanUtils.java:222)
	at org.springframework.beans.factory.support.SimpleInstantiationStrategy.instantiate(SimpleInstantiationStrategy.java:145)
	at org.springframework.beans.factory.support.ConstructorResolver.instantiate(ConstructorResolver.java:318)
	... 45 more
Caused by: software.amazon.awssdk.core.exception.SdkClientException: Unable to marshall request to JSON: Parameter 'Bucket' must not be null
	at software.amazon.awssdk.core.exception.SdkClientException$BuilderImpl.build(SdkClientException.java:111)
	at software.amazon.awssdk.services.s3.transform.HeadBucketRequestMarshaller.marshall(HeadBucketRequestMarshaller.java:53)
	at software.amazon.awssdk.services.s3.transform.HeadBucketRequestMarshaller.marshall(HeadBucketRequestMarshaller.java:31)
	at software.amazon.awssdk.core.internal.handler.BaseClientHandler.lambda$finalizeSdkHttpFullRequest$0(BaseClientHandler.java:73)
	at software.amazon.awssdk.core.internal.util.MetricUtils.measureDuration(MetricUtils.java:50)
	at software.amazon.awssdk.core.internal.handler.BaseClientHandler.finalizeSdkHttpFullRequest(BaseClientHandler.java:72)
	at software.amazon.awssdk.core.internal.handler.BaseSyncClientHandler.doExecute(BaseSyncClientHandler.java:151)
	at software.amazon.awssdk.core.internal.handler.BaseSyncClientHandler.lambda$execute$1(BaseSyncClientHandler.java:82)
	at software.amazon.awssdk.core.internal.handler.BaseSyncClientHandler.measureApiCallSuccess(BaseSyncClientHandler.java:179)
	at software.amazon.awssdk.core.internal.handler.BaseSyncClientHandler.execute(BaseSyncClientHandler.java:76)
	at software.amazon.awssdk.core.client.handler.SdkSyncClientHandler.execute(SdkSyncClientHandler.java:45)
	at software.amazon.awssdk.awscore.client.handler.AwsSyncClientHandler.execute(AwsSyncClientHandler.java:56)
	at software.amazon.awssdk.services.s3.DefaultS3Client.headBucket(DefaultS3Client.java:5249)
	at com.example.insuranceclaim_backend.service.S3StorageService.ensureBucketExists(S3StorageService.java:27)
	at com.example.insuranceclaim_backend.service.S3StorageService.<init>(S3StorageService.java:22)
	at java.base/java.lang.reflect.Constructor.newInstanceWithCaller(Constructor.java:502)
	at java.base/java.lang.reflect.Constructor.newInstance(Constructor.java:486)
	at org.springframework.beans.BeanUtils.instantiateClass(BeanUtils.java:209)
	... 47 more
Caused by: java.lang.IllegalArgumentException: Parameter 'Bucket' must not be null
	at software.amazon.awssdk.protocols.xml.internal.marshall.SimpleTypePathMarshaller.lambda$static$0(SimpleTypePathMarshaller.java:46)
	at software.amazon.awssdk.protocols.xml.internal.marshall.XmlProtocolMarshaller.doMarshall(XmlProtocolMarshaller.java:104)
	at software.amazon.awssdk.protocols.xml.internal.marshall.XmlProtocolMarshaller.marshall(XmlProtocolMarshaller.java:80)
	at software.amazon.awssdk.protocols.xml.internal.marshall.XmlProtocolMarshaller.marshall(XmlProtocolMarshaller.java:49)
	at software.amazon.awssdk.services.s3.transform.HeadBucketRequestMarshaller.marshall(HeadBucketRequestMarshaller.java:51)
	... 63 more

[INFO] 
[INFO] Results:
[INFO] 
[ERROR] Errors: 
[ERROR]   InsuranceclaimBackendApplicationTests.contextLoads  IllegalState Failed to load ApplicationContext for [WebMergedContextConfiguration@7e76a66f testClass = com.example.insuranceclaim_backend.InsuranceclaimBackendApplicationTests, locations = [], classes = [com.example.insuranceclaim_backend.InsuranceclaimBackendApplication], contextInitializerClasses = [], activeProfiles = ["test"], propertySourceDescriptors = [], propertySourceProperties = ["org.springframework.boot.test.context.SpringBootTestContextBootstrapper=true"], contextCustomizers = [org.springframework.boot.test.context.filter.ExcludeFilterContextCustomizer@4808bc9b, org.springframework.boot.test.json.DuplicateJsonObjectContextCustomizerFactory$DuplicateJsonObjectContextCustomizer@72d6b3ba, org.springframework.boot.test.mock.mockito.MockitoContextCustomizer@0, org.springframework.boot.test.web.client.TestRestTemplateContextCustomizer@471a9022, org.springframework.boot.test.web.reactor.netty.DisableReactorResourceFactoryGlobalResourcesContextCustomizerFactory$DisableReactorResourceFactoryGlobalResourcesContextCustomizerCustomizer@791d1f8b, org.springframework.boot.test.autoconfigure.OnFailureConditionReportContextCustomizerFactory$OnFailureConditionReportContextCustomizer@13bc8645, org.springframework.boot.test.autoconfigure.actuate.observability.ObservabilityContextCustomizerFactory$DisableObservabilityContextCustomizer@1f, org.springframework.boot.test.autoconfigure.properties.PropertyMappingContextCustomizer@0, org.springframework.boot.test.autoconfigure.web.servlet.WebDriverContextCustomizer@4f4c4b1a, org.springframework.test.context.support.DynamicPropertiesContextCustomizer@0, org.springframework.boot.test.context.SpringBootTestAnnotation@bd271ef8], resourceBasePath = "src/main/webapp", contextLoader = org.springframework.boot.test.context.SpringBootContextLoader, parent = null]
[INFO] 
[ERROR] Tests run: 1, Failures: 0, Errors: 1, Skipped: 0
[INFO] 
[INFO] ------------------------------------------------------------------------
[INFO] BUILD FAILURE
[INFO] ------------------------------------------------------------------------
[INFO] Total time:  6.763 s
[INFO] Finished at: 2025-01-29T12:42:40-03:00
[INFO] ------------------------------------------------------------------------
[ERROR] Failed to execute goal org.apache.maven.plugins:maven-surefire-plugin:3.5.2:test (default-test) on project insuranceclaim-backend: 
[ERROR] 
[ERROR] See F:\Projetos\insurance-backup-project\backend\target\surefire-reports for the individual test results.
[ERROR] See dump files (if any exist) [date].dump, [date]-jvmRun[N].dump and [date].dumpstream.
[ERROR] -> [Help 1]
[ERROR] 
[ERROR] To see the full stack trace of the errors, re-run Maven with the -e switch.
[ERROR] Re-run Maven using the -X switch to enable full debug logging.
[ERROR] 
[ERROR] For more information about the errors and possible solutions, please read the following articles:
[ERROR] [Help 1] http://cwiki.apache.org/confluence/display/MAVEN/MojoFailureException
